{
  "agentId": "agent-sales-assistant-001",
  "name": "Sales Assistant Agent",
  "description": "AI agent that assists sales reps by querying Salesforce CRM and drafting emails.",
  "model": "claude-3-5-sonnet-20241022",
  "organizationId": "org-acme-corp",
  "userId": "user-john-smith",
  "mcpConnections": [
    {
      "mcpServerId": "mcp-salesforce-001",
      "permissions": ["read:contacts", "read:opportunities", "write:tasks"]
    },
    {
      "mcpServerId": "mcp-gmail-001",
      "permissions": ["write:drafts"]
    }
  ],
  "status": "active",
  "createdAt": "2026-04-01T09:00:00Z"
}
